{
  "case_id": "case-fictional-northbridge-001",
  "action_type": "export_unrestricted_mailbox",
  "action_class": "PROHIBITED",
  "purpose": "Refused example. Unrestricted mailbox export is outside Layer 0 and practice boundary.",
  "target_system": "email",
  "target_entity": "mailbox:all",
  "intended_effect": "Export all mail. This must not proceed.",
  "data_classification": "RESTRICTED",
  "reversibility": "irreversible",
  "circuit_breaker_status": "TRIGGERED",
  "policy_version": "aios-v1.2.0-alpha",
  "proposal_id": "prop-prohibited-001",
  "proposal_version": 1,
  "proposal_digest": "dddddddddddddddddddddddddddddddddddddddddddddddddddddddddddddddd",
  "created_at": "2026-08-30T12:30:00Z",
  "idempotency_key": "prohibited-001"
}
