{
  "case_id": "case-fictional-northbridge-001",
  "action_type": "send_non_binding_enquiry",
  "action_class": "RED",
  "purpose": "Send a non-binding enquiry asking whether a public briefing exists. No commercial commitment.",
  "target_system": "email",
  "target_entity": "briefings@example.invalid",
  "recipient_or_affected_party": "briefings@example.invalid",
  "intended_effect": "Send the exact approved text asking only whether a public briefing pack exists. No fee, date or delivery commitment.",
  "payload_reference": "email-body:red-enquiry-v1",
  "attachment_references": [],
  "evidence_references": ["finding:public-contact-page"],
  "assumptions": ["The published contact address is current."],
  "unknowns": ["Whether the address is monitored."],
  "data_classification": "INTERNAL",
  "disclosure_summary": "Practice name, return address, and a request for a public pack. No CV, no rates, no client names.",
  "reversibility": "partially_reversible",
  "rollback_or_containment_plan": "Send a written withdrawal of the enquiry if it was not the authorised text. Do not send follow-up commitments.",
  "opportunity_quality_snapshot": "No mandate to deliver work. Enquiry only. Authority to commit commercially is absent.",
  "risk_classification": "RED",
  "circuit_breaker_status": "CLEAR",
  "policy_version": "aios-v1.2.0-alpha",
  "proposal_id": "prop-red-001",
  "proposal_version": 1,
  "proposal_digest": "cccccccccccccccccccccccccccccccccccccccccccccccccccccccccccccccc",
  "created_at": "2026-08-30T12:10:00Z",
  "expires_at": "2026-08-30T16:00:00Z",
  "idempotency_key": "red-proposal-001"
}
