{
  "case_id": "case-fictional-northbridge-001",
  "action_type": "retrieve_public_programme_page",
  "action_class": "GREEN",
  "purpose": "Compare a public programme page with stated eligibility rules before any outreach.",
  "target_system": "public_web",
  "target_entity": "https://example.invalid/northbridge-civic-trust/programmes",
  "intended_effect": "Read the public programme summary. No message is sent. No record is written.",
  "payload_reference": "public-page:northbridge-programmes",
  "attachment_references": [],
  "evidence_references": ["source:public-programme-page"],
  "assumptions": ["The page is current as of created_at."],
  "unknowns": ["Whether a vacancy exists."],
  "data_classification": "PUBLIC",
  "disclosure_summary": "No data is disclosed outbound. Inbound content is public.",
  "reversibility": "reversible",
  "opportunity_quality_snapshot": "No mandate to act. Retrieval only.",
  "risk_classification": "GREEN",
  "circuit_breaker_status": "CLEAR",
  "policy_version": "aios-v1.2.0-alpha",
  "proposal_id": "prop-green-001",
  "proposal_version": 1,
  "proposal_digest": "aaaaaaaaaaaaaaaaaaaaaaaaaaaaaaaaaaaaaaaaaaaaaaaaaaaaaaaaaaaaaaaa",
  "created_at": "2026-08-30T12:00:00Z",
  "idempotency_key": "green-preflight-001"
}
