{
  "case_id": "case-fictional-northbridge-001",
  "action_type": "create_calendar_hold",
  "action_class": "AMBER",
  "purpose": "Hold a 30-minute internal preparation slot. Non-binding. No external attendee.",
  "target_system": "calendar",
  "target_entity": "calendar:human-captain-internal",
  "recipient_or_affected_party": "human-captain@example.invalid",
  "intended_effect": "Create a private calendar hold titled 'Northbridge preparation'. No invitation is sent outside the practice.",
  "payload_reference": "calendar-hold:northbridge-prep",
  "attachment_references": [],
  "evidence_references": ["finding:public-programme-page"],
  "assumptions": ["The Human Captain owns the target calendar."],
  "unknowns": ["Whether the hold conflicts with an unpublished commitment."],
  "data_classification": "INTERNAL",
  "disclosure_summary": "Event title and time only. No client file is attached.",
  "reversibility": "reversible",
  "rollback_or_containment_plan": "Delete the calendar hold if unused.",
  "opportunity_quality_snapshot": "No external mandate. Internal preparation only.",
  "risk_classification": "AMBER",
  "circuit_breaker_status": "CLEAR",
  "policy_version": "aios-v1.2.0-alpha",
  "proposal_id": "prop-amber-001",
  "proposal_version": 1,
  "proposal_digest": "bbbbbbbbbbbbbbbbbbbbbbbbbbbbbbbbbbbbbbbbbbbbbbbbbbbbbbbbbbbbbbbb",
  "created_at": "2026-08-30T12:05:00Z",
  "expires_at": "2026-08-30T18:00:00Z",
  "idempotency_key": "amber-proposal-001"
}
